{
  "version": "2.0",
  "asset_id": "urn:uuid:550e8400-e29b-41d4-a716-446655440030",
  "kind": "segmentation-mask-3d",
  "name": "Bunny 3D per-point segmentation labels",
  "created_at": "2025-05-01T09:25:00Z",
  "derived_from": [
    "urn:uuid:550e8400-e29b-41d4-a716-446655440001",
    "urn:uuid:550e8400-e29b-41d4-a716-446655440020"
  ],
  "representations": [
    {
      "rep_id": "rep-labels-npy",
      "format": "npy",
      "uri": "samples/inspection/bunny_labels.npy",
      "mime_type": "application/x-npy",
      "point_count": 35947
    }
  ],
  "workflow": {
    "step": "lift-3d",
    "target_asset_id": "urn:uuid:550e8400-e29b-41d4-a716-446655440001",
    "source_masks": [
      "urn:uuid:550e8400-e29b-41d4-a716-446655440020"
    ],
    "labels": [
      {"id": 0, "name": "background", "color": [0, 0, 0]},
      {"id": 1, "name": "bunny",      "color": [255, 128, 0]}
    ],
    "confidence": 0.881,
    "tool": "depth-projection-lifter",
    "tool_version": "1.0.0",
    "parameters": {
      "strategy": "nearest-point",
      "depth_tolerance_m": 0.005
    },
    "started_at": "2025-05-01T09:25:00Z",
    "completed_at": "2025-05-01T09:25:03Z"
  },
  "metadata": {
    "label_counts": {"0": 4743, "1": 31204}
  }
}
